{
  "script_report_version": 1,
  "contract_version": 1,
  "script": {
    "path": "suite.mjs",
    "sha256": "b9ddb9551cb9cb7d0cc877c561e4737df5906e4e260f36584d6d2c944f05c557",
    "bytes": 85964
  },
  "run": {
    "started_at": "2026-07-26T05:36:56.166Z",
    "finished_at": "2026-07-26T05:36:56.663Z",
    "duration_ms": 497,
    "base_url": "http://127.0.0.1:4301",
    "allowed_origins": [],
    "mode": "read-write",
    "write_grant": {
      "origin": "http://127.0.0.1:4301",
      "approved_by": "S0 study owner — disposable loopback ledger fixture (studies/api-suite/TARGET-AUTHORIZATION.md)",
      "approved_at": "2026-07-26"
    },
    "budget": {
      "limit": 360,
      "used": 214,
      "remaining": 146
    },
    "timeout_ms": 600000,
    "read_only_methods": [
      "GET",
      "HEAD"
    ],
    "secrets_declared": [
      "LEDGER_ADMIN_TOKEN",
      "LEDGER_CUSTOMER_B_TOKEN",
      "LEDGER_CUSTOMER_TOKEN"
    ],
    "params": {
      "seed": "ledger-dev-seed"
    },
    "exit": {
      "code": 0
    }
  },
  "checks": [
    {
      "id": "reset-restores-the-seeded-world",
      "obligation": "rule:round-trip-consistency-and-determinism",
      "title": "POST /admin/reset returns ok/seed/day and leaves exactly the two system fee accounts at day 0",
      "pass": true,
      "exercised": true,
      "expected": "200 {ok:true,seed:\"ledger-dev-seed\",day:0} and a world holding exactly [acc_fee_usd, acc_fee_eur]",
      "observed": "200 {\"ok\":true,\"seed\":\"ledger-dev-seed\",\"day\":0} / world=[\"acc_fee_usd\",\"acc_fee_eur\"]",
      "evidence": {
        "har_entries": [
          0,
          3
        ]
      }
    },
    {
      "id": "fee-schedule-document-agrees-with-the-stated-rule",
      "obligation": "rule:the-fee-schedule",
      "title": "the live document states the same one schedule the invariant states (25 flat + 15bp, one table for both currencies)",
      "pass": true,
      "exercised": true,
      "expected": "flat 25, 15 bp, daily limit 100000, fee accounts USD=acc_fee_usd EUR=acc_fee_eur",
      "observed": "{\"flat\":25,\"basis_points\":15,\"formula\":\"fee = 25 + round_half_up(amount * 15 / 10000), in minor units\",\"rounding\":\"half away from zero, to the nearest minor unit\",\"charged_to\":\"the source account, on top of the transfer amount\",\"credited_to\":\"the system fee account for the transfer's currency\"} / {\"daily_transfer_limit\":100000,\"max_page_size\":100,\"default_page_size\":20,\"fee_accounts\":{\"USD\":\"acc_fee_usd\",\"EUR\":\"acc_fee_eur\"}}",
      "evidence": {
        "har_entries": [
          2
        ]
      }
    },
    {
      "id": "health-answers-without-a-credential",
      "obligation": "rule:error-shape-and-the-status-split-three-rules",
      "title": "GET /health is declared with empty security and answers 200 without a credential (no 401 for an unauthenticated operation)",
      "pass": true,
      "exercised": true,
      "expected": "200 {ok:true, service:<string>}",
      "observed": "200 {\"ok\":true,\"service\":\"minibank-ledger\",\"openapi\":\"/openapi.json\"}",
      "evidence": {
        "har_entries": [
          1
        ]
      }
    },
    {
      "id": "lifecycle-new-account-is-pending-then-active",
      "obligation": "rule:lifecycle-legality",
      "title": "an account is created 'pending' with a zero balance and becomes 'active' only via activate",
      "pass": true,
      "exercised": true,
      "expected": "201 pending/balance 0/activated_at null, then 200 active with activated_at set",
      "observed": "201 {\"id\":\"acc_zc946y142d\",\"kind\":\"customer\",\"owner\":\"ada\",\"owner_principal\":\"customer_a\",\"currency\":\"USD\",\"status\":\"pending\",\"balance\":0,\"created_at\":\"2026-01-01T00:00:07.000Z\",\"activated_at\":null,\"closed_at\":null} then 200 {\"id\":\"acc_zc946y142d\",\"kind\":\"customer\",\"owner\":\"ada\",\"owner_principal\":\"customer_a\",\"currency\":\"USD\",\"status\":\"active\",\"balance\":0,\"created_at\":\"2026-01-01T00:00:07.000Z\",\"activated_at\":\"2026-01-01T00:00:08.000Z\",\"closed_at\":null}",
      "evidence": {
        "har_entries": [
          10,
          11
        ]
      }
    },
    {
      "id": "ownership-only-admin-opens-an-account-for-another-principal",
      "obligation": "rule:ownership",
      "title": "the administrator may set owner_principal on someone else's behalf and the account belongs to that principal",
      "pass": true,
      "exercised": true,
      "expected": "201 with owner_principal \"customer_b\", distinct from \"customer_a\"",
      "observed": "201 {\"id\":\"acc_ygjxfr236z\",\"kind\":\"customer\",\"owner\":\"opened-for-b\",\"owner_principal\":\"customer_b\",\"currency\":\"USD\",\"status\":\"pending\",\"balance\":0,\"created_at\":\"2026-01-01T00:00:30.000Z\",\"activated_at\":null,\"closed_at\":null}",
      "evidence": {
        "har_entries": [
          33,
          4,
          7
        ]
      }
    },
    {
      "id": "fee-declared-usd-1",
      "obligation": "rule:the-fee-schedule",
      "title": "a USD transfer of 1 declares fee 25 = 25 + round_half_up(1*15/10000)",
      "pass": true,
      "exercised": true,
      "expected": "201 with fee 25, amount 1, currency USD",
      "observed": "201 {\"id\":\"tr_vrj7fd3vrs\",\"status\":\"pending\",\"source_account_id\":\"acc_zc946y142d\",\"destination_account_id\":\"acc_73jcjqkppr\",\"fee_account_id\":\"acc_fee_usd\",\"amount\":1,\"fee\":25,\"currency\":\"USD\",\"idempotency_key\":null,\"failure_reason\":null,\"create",
      "evidence": {
        "har_entries": [
          34
        ]
      }
    },
    {
      "id": "fee-declared-usd-333",
      "obligation": "rule:the-fee-schedule",
      "title": "a USD transfer of 333 declares fee 25 = 25 + round_half_up(333*15/10000)",
      "pass": true,
      "exercised": true,
      "expected": "201 with fee 25, amount 333, currency USD",
      "observed": "201 {\"id\":\"tr_r5p6w2g89v\",\"status\":\"pending\",\"source_account_id\":\"acc_zc946y142d\",\"destination_account_id\":\"acc_73jcjqkppr\",\"fee_account_id\":\"acc_fee_usd\",\"amount\":333,\"fee\":25,\"currency\":\"USD\",\"idempotency_key\":null,\"failure_reason\":null,\"crea",
      "evidence": {
        "har_entries": [
          35
        ]
      }
    },
    {
      "id": "fee-declared-usd-334",
      "obligation": "rule:the-fee-schedule",
      "title": "a USD transfer of 334 declares fee 26 = 25 + round_half_up(334*15/10000)",
      "pass": true,
      "exercised": true,
      "expected": "201 with fee 26, amount 334, currency USD",
      "observed": "201 {\"id\":\"tr_hxf94wpr0h\",\"status\":\"pending\",\"source_account_id\":\"acc_zc946y142d\",\"destination_account_id\":\"acc_73jcjqkppr\",\"fee_account_id\":\"acc_fee_usd\",\"amount\":334,\"fee\":26,\"currency\":\"USD\",\"idempotency_key\":null,\"failure_reason\":null,\"crea",
      "evidence": {
        "har_entries": [
          36
        ]
      }
    },
    {
      "id": "fee-declared-usd-1000",
      "obligation": "rule:the-fee-schedule",
      "title": "a USD transfer of 1000 declares fee 27 = 25 + round_half_up(1000*15/10000)",
      "pass": true,
      "exercised": true,
      "expected": "201 with fee 27, amount 1000, currency USD",
      "observed": "201 {\"id\":\"tr_52yy5z920j\",\"status\":\"pending\",\"source_account_id\":\"acc_zc946y142d\",\"destination_account_id\":\"acc_73jcjqkppr\",\"fee_account_id\":\"acc_fee_usd\",\"amount\":1000,\"fee\":27,\"currency\":\"USD\",\"idempotency_key\":null,\"failure_reason\":null,\"cre",
      "evidence": {
        "har_entries": [
          37
        ]
      }
    },
    {
      "id": "fee-declared-usd-3000",
      "obligation": "rule:the-fee-schedule",
      "title": "a USD transfer of 3000 declares fee 30 = 25 + round_half_up(3000*15/10000)",
      "pass": true,
      "exercised": true,
      "expected": "201 with fee 30, amount 3000, currency USD",
      "observed": "201 {\"id\":\"tr_hxsdxmpskg\",\"status\":\"pending\",\"source_account_id\":\"acc_zc946y142d\",\"destination_account_id\":\"acc_73jcjqkppr\",\"fee_account_id\":\"acc_fee_usd\",\"amount\":3000,\"fee\":30,\"currency\":\"USD\",\"idempotency_key\":null,\"failure_reason\":null,\"cre",
      "evidence": {
        "har_entries": [
          38
        ]
      }
    },
    {
      "id": "fee-declared-usd-10000",
      "obligation": "rule:the-fee-schedule",
      "title": "a USD transfer of 10000 declares fee 40 = 25 + round_half_up(10000*15/10000)",
      "pass": true,
      "exercised": true,
      "expected": "201 with fee 40, amount 10000, currency USD",
      "observed": "201 {\"id\":\"tr_1vdkmyt8dp\",\"status\":\"pending\",\"source_account_id\":\"acc_zc946y142d\",\"destination_account_id\":\"acc_73jcjqkppr\",\"fee_account_id\":\"acc_fee_usd\",\"amount\":10000,\"fee\":40,\"currency\":\"USD\",\"idempotency_key\":null,\"failure_reason\":null,\"cr",
      "evidence": {
        "har_entries": [
          39
        ]
      }
    },
    {
      "id": "fee-declared-eur-1",
      "obligation": "rule:the-fee-schedule",
      "title": "a EUR transfer of 1 declares fee 25 = 25 + round_half_up(1*15/10000)",
      "pass": true,
      "exercised": true,
      "expected": "201 with fee 25, amount 1, currency EUR",
      "observed": "201 {\"id\":\"tr_m8d4wgsckp\",\"status\":\"pending\",\"source_account_id\":\"acc_zcshq4p7ds\",\"destination_account_id\":\"acc_6dpt5gfs8w\",\"fee_account_id\":\"acc_fee_eur\",\"amount\":1,\"fee\":25,\"currency\":\"EUR\",\"idempotency_key\":null,\"failure_reason\":null,\"create",
      "evidence": {
        "har_entries": [
          40
        ]
      }
    },
    {
      "id": "fee-declared-eur-1000",
      "obligation": "rule:the-fee-schedule",
      "title": "a EUR transfer of 1000 declares fee 27 = 25 + round_half_up(1000*15/10000)",
      "pass": true,
      "exercised": true,
      "expected": "201 with fee 27, amount 1000, currency EUR",